{
  "setSize": 9,
  "corpusSize": 7776,
  "correctThreshold": 6,
  "randomBytes": [
    "E4C57A65D4EA5129421C3E812734D8AF3458ED9DEED1DCFB2E6B470C1074192A",
    "1B6B5FC182E3D94132763622F4E0D8B2ECBB0154C97618771BAB9421EF3B1488",
    "6C1B1855F77171C536BCC29F514ACE8668FE60D24E50EA483C9F3205F581AF6A"
  ]
}
